<!ELEMENT llista_comandes (comanda*)>
<!ELEMENT comanda (numero_serie, quantitat, pes_quilos?)>
<!ATTLIST comanda n CDATA #REQUIRED>
<!ELEMENT numero_serie (#PCDATA)>
<!ELEMENT quantitat (#PCDATA)>
<!ELEMENT pes_quilos (#PCDATA)>